"No.","Time","Source","Destination","Protocol","Length","Info"
"1","0.000000","52.42.164.78","192.168.0.86","TCP","66","443  >  63250 [ACK] Seq=1 Ack=1 Win=200 Len=0 TSval=132018536 TSecr=1082454183"
"2","0.001294","192.168.0.86","52.42.164.78","TCP","1506","[TCP segment of a reassembled PDU]"
"3","0.001296","192.168.0.86","52.42.164.78","TCP","1506","[TCP segment of a reassembled PDU]"
"4","0.008835","52.42.164.78","192.168.0.86","TCP","66","443  >  63250 [ACK] Seq=1 Ack=1441 Win=211 Len=0 TSval=132018538 TSecr=1082454183"
"5","0.008882","192.168.0.86","52.42.164.78","TCP","1506","[TCP segment of a reassembled PDU]"
"6","0.008883","192.168.0.86","52.42.164.78","TCP","1506","[TCP segment of a reassembled PDU]"
"7","0.014326","192.168.0.1","239.255.255.250","SSDP","325","NOTIFY * HTTP/1.1 "
"8","0.014400","192.168.0.1","239.255.255.250","SSDP","316","NOTIFY * HTTP/1.1 "
"9","0.014460","192.168.0.1","239.255.255.250","SSDP","368","NOTIFY * HTTP/1.1 "
"10","0.014525","192.168.0.1","239.255.255.250","SSDP","380","NOTIFY * HTTP/1.1 "
"11","0.014585","192.168.0.1","239.255.255.250","SSDP","382","NOTIFY * HTTP/1.1 "
"12","0.014660","192.168.0.1","239.255.255.250","SSDP","396","NOTIFY * HTTP/1.1 "
"13","0.123719","52.42.164.78","192.168.0.86","TCP","66","443  >  63250 [ACK] Seq=1 Ack=2881 Win=222 Len=0 TSval=132018567 TSecr=1082454306"
"14","0.123758","192.168.0.86","52.42.164.78","TCP","1506","[TCP segment of a reassembled PDU]"
"15","0.132588","52.42.164.78","192.168.0.86","TCP","66","443  >  63250 [ACK] Seq=1 Ack=4321 Win=233 Len=0 TSval=132018569 TSecr=1082454306"
"16","0.132702","192.168.0.86","52.42.164.78","TCP","1506","[TCP segment of a reassembled PDU]"
"17","0.140648","52.42.164.78","192.168.0.86","TCP","66","443  >  63250 [ACK] Seq=1 Ack=5761 Win=245 Len=0 TSval=132018571 TSecr=1082454314"
"18","0.140672","192.168.0.86","52.42.164.78","TCP","1506","[TCP segment of a reassembled PDU]"
"19","0.149626","52.42.164.78","192.168.0.86","TCP","66","443  >  63250 [ACK] Seq=1 Ack=7201 Win=256 Len=0 TSval=132018573 TSecr=1082454314"
"20","0.149718","192.168.0.86","52.42.164.78","TCP","1506","[TCP segment of a reassembled PDU]"
"21","0.158508","52.42.164.78","192.168.0.86","TCP","66","443  >  63250 [ACK] Seq=1 Ack=8641 Win=267 Len=0 TSval=132018576 TSecr=1082454322"
"22","0.158559","192.168.0.86","52.42.164.78","TCP","1506","[TCP segment of a reassembled PDU]"
"23","0.167407","52.42.164.78","192.168.0.86","TCP","66","443  >  63250 [ACK] Seq=1 Ack=10081 Win=278 Len=0 TSval=132018578 TSecr=1082454322"
"24","0.167458","192.168.0.86","52.42.164.78","TCP","1506","[TCP segment of a reassembled PDU]"
"25","0.176027","52.42.164.78","192.168.0.86","TCP","66","443  >  63250 [ACK] Seq=1 Ack=11521 Win=290 Len=0 TSval=132018580 TSecr=1082454331"
"26","0.176117","192.168.0.86","52.42.164.78","TCP","1506","[TCP segment of a reassembled PDU]"
"27","0.184458","52.42.164.78","192.168.0.86","TCP","66","443  >  63250 [ACK] Seq=1 Ack=12961 Win=301 Len=0 TSval=132018582 TSecr=1082454331"
"28","0.184519","192.168.0.86","52.42.164.78","TCP","1506","[TCP segment of a reassembled PDU]"
"29","0.193094","52.42.164.78","192.168.0.86","TCP","66","443  >  63250 [ACK] Seq=1 Ack=14401 Win=312 Len=0 TSval=132018584 TSecr=1082454349"
"30","0.193123","192.168.0.86","52.42.164.78","TCP","1506","[TCP segment of a reassembled PDU]"
"31","0.193327","192.168.0.86","185.118.124.154","TCP","54","61273  >  80 [ACK] Seq=1 Ack=1 Win=4127 Len=0"
"32","0.201984","52.42.164.78","192.168.0.86","TCP","66","443  >  63250 [ACK] Seq=1 Ack=15841 Win=323 Len=0 TSval=132018586 TSecr=1082454349"
"33","0.202036","192.168.0.86","52.42.164.78","TCP","1506","[TCP segment of a reassembled PDU]"
"34","0.209794","52.42.164.78","192.168.0.86","TCP","78","[TCP Window Update] 443  >  63250 [ACK] Seq=1 Ack=15841 Win=335 Len=0 TSval=132018588 TSecr=1082454349 SLE=17281 SRE=18721"
"35","0.209812","192.168.0.86","52.42.164.78","TCP","1506","[TCP segment of a reassembled PDU]"
"36","0.218933","185.118.124.154","192.168.0.86","TCP","78","[TCP ACKed unseen segment] 80  >  61273 [ACK] Seq=1 Ack=2 Win=543 Len=0 TSval=618995895 TSecr=1081734214 SLE=1 SRE=1"
"37","0.218935","52.42.164.78","192.168.0.86","TCP","66","443  >  63250 [ACK] Seq=1 Ack=18721 Win=346 Len=0 TSval=132018591 TSecr=1082454357"
"38","0.219007","192.168.0.86","52.42.164.78","SSLv2","1506","Encrypted Data"
"39","0.243800","192.168.0.86","17.188.140.184","TCP","54","60864  >  443 [ACK] Seq=1 Ack=1 Win=4096 Len=0"
"40","0.292802","52.42.164.78","192.168.0.86","TCP","66","443  >  63250 [ACK] Seq=1 Ack=20161 Win=357 Len=0 TSval=132018609 TSecr=1082454471"
"41","0.292868","192.168.0.86","52.42.164.78","TCP","1506","[TCP segment of a reassembled PDU]"
"42","0.292868","192.168.0.86","52.42.164.78","TCP","1506","[TCP segment of a reassembled PDU]"
"43","0.301875","52.42.164.78","192.168.0.86","TCP","66","443  >  63250 [ACK] Seq=1 Ack=21601 Win=368 Len=0 TSval=132018611 TSecr=1082454479"
"44","0.301901","192.168.0.86","52.42.164.78","TCP","1506","[TCP segment of a reassembled PDU]"
"45","0.301902","192.168.0.86","52.42.164.78","TCP","1506","[TCP segment of a reassembled PDU]"
"46","0.310602","52.42.164.78","192.168.0.86","TCP","66","443  >  63250 [ACK] Seq=1 Ack=23041 Win=380 Len=0 TSval=132018614 TSecr=1082454487"
"47","0.310748","192.168.0.86","52.42.164.78","TCP","1506","[TCP segment of a reassembled PDU]"
"48","0.310748","192.168.0.86","52.42.164.78","TCP","1506","63250  >  443 [ACK] Seq=43201 Ack=1 Win=4096 Len=1440 TSval=1082454648 TSecr=132018614"
"49","0.319069","52.42.164.78","192.168.0.86","TCP","66","443  >  63250 [ACK] Seq=1 Ack=24481 Win=391 Len=0 TSval=132018616 TSecr=1082454495"
"50","0.319144","192.168.0.86","52.42.164.78","TCP","1506","[TCP segment of a reassembled PDU]"
"51","0.319145","192.168.0.86","52.42.164.78","TCP","1506","[TCP segment of a reassembled PDU]"
"52","0.327578","52.42.164.78","192.168.0.86","TCP","66","443  >  63250 [ACK] Seq=1 Ack=25921 Win=402 Len=0 TSval=132018618 TSecr=1082454503"
"53","0.327654","192.168.0.86","52.42.164.78","TCP","1506","[TCP segment of a reassembled PDU]"
"54","0.327655","192.168.0.86","52.42.164.78","TCP","1506","[TCP segment of a reassembled PDU]"
"55","0.337367","52.42.164.78","192.168.0.86","TCP","66","443  >  63250 [ACK] Seq=1 Ack=27361 Win=413 Len=0 TSval=132018620 TSecr=1082454511"
"56","0.337416","192.168.0.86","52.42.164.78","TCP","1506","[TCP segment of a reassembled PDU]"
"57","0.337416","192.168.0.86","52.42.164.78","TCP","1506","[TCP segment of a reassembled PDU]"
"58","0.345660","52.42.164.78","192.168.0.86","TCP","66","443  >  63250 [ACK] Seq=1 Ack=28801 Win=422 Len=0 TSval=132018622 TSecr=1082454519"
"59","0.345745","192.168.0.86","52.42.164.78","TCP","1506","[TCP segment of a reassembled PDU]"
"60","0.345746","192.168.0.86","52.42.164.78","TCP","1506","[TCP segment of a reassembled PDU]"
"61","0.353971","52.42.164.78","192.168.0.86","TCP","66","443  >  63250 [ACK] Seq=1 Ack=30241 Win=422 Len=0 TSval=132018624 TSecr=1082454526"
"62","0.353992","192.168.0.86","52.42.164.78","TCP","1506","[TCP segment of a reassembled PDU]"
"63","0.353992","192.168.0.86","52.42.164.78","TCP","1506","[TCP segment of a reassembled PDU]"
"64","0.363104","52.42.164.78","192.168.0.86","TCP","66","443  >  63250 [ACK] Seq=1 Ack=31681 Win=422 Len=0 TSval=132018627 TSecr=1082454534"
"65","0.363174","192.168.0.86","52.42.164.78","TCP","1506","[TCP segment of a reassembled PDU]"
"66","0.363174","192.168.0.86","52.42.164.78","SSLv2","1506","Encrypted Data"
"67","0.371942","52.42.164.78","192.168.0.86","TCP","66","443  >  63250 [ACK] Seq=1 Ack=33121 Win=422 Len=0 TSval=132018629 TSecr=1082454542"
"68","0.372000","192.168.0.86","52.42.164.78","TCP","1506","[TCP segment of a reassembled PDU]"
"69","0.372001","192.168.0.86","52.42.164.78","TCP","1506","[TCP segment of a reassembled PDU]"
"70","0.380862","52.42.164.78","192.168.0.86","TCP","66","443  >  63250 [ACK] Seq=1 Ack=34561 Win=422 Len=0 TSval=132018631 TSecr=1082454549"
"71","0.380885","192.168.0.86","52.42.164.78","SSLv2","1506","Encrypted Data"
"72","0.380886","192.168.0.86","52.42.164.78","TCP","1506","[TCP segment of a reassembled PDU]"
"73","0.388033","17.188.140.184","192.168.0.86","TCP","66","[TCP ACKed unseen segment] 443  >  60864 [ACK] Seq=1 Ack=2 Win=261 Len=0 TSval=750879282 TSecr=1076447279"
"74","0.389242","52.42.164.78","192.168.0.86","TCP","66","443  >  63250 [ACK] Seq=1 Ack=36001 Win=422 Len=0 TSval=132018633 TSecr=1082454558"
"75","0.389333","192.168.0.86","52.42.164.78","TCP","1506","[TCP segment of a reassembled PDU]"
"76","0.389335","192.168.0.86","52.42.164.78","TCP","1506","[TCP segment of a reassembled PDU]"
"77","0.461981","52.42.164.78","192.168.0.86","TCP","66","443  >  63250 [ACK] Seq=1 Ack=37441 Win=422 Len=0 TSval=132018651 TSecr=1082454631"
"78","0.462043","192.168.0.86","52.42.164.78","TCP","1506","[TCP segment of a reassembled PDU]"
"79","0.470275","52.42.164.78","192.168.0.86","TCP","66","443  >  63250 [ACK] Seq=1 Ack=38881 Win=422 Len=0 TSval=132018653 TSecr=1082454631"
"80","0.470345","192.168.0.86","52.42.164.78","TCP","1506","[TCP segment of a reassembled PDU]"
"81","0.479039","52.42.164.78","192.168.0.86","TCP","66","443  >  63250 [ACK] Seq=1 Ack=40321 Win=422 Len=0 TSval=132018656 TSecr=1082454640"
"82","0.479096","192.168.0.86","52.42.164.78","TCP","1506","[TCP segment of a reassembled PDU]"
"83","0.487924","52.42.164.78","192.168.0.86","TCP","66","443  >  63250 [ACK] Seq=1 Ack=41761 Win=422 Len=0 TSval=132018658 TSecr=1082454640"
"84","0.487979","192.168.0.86","52.42.164.78","TCP","1506","[TCP segment of a reassembled PDU]"
"85","0.496924","52.42.164.78","192.168.0.86","TCP","66","443  >  63250 [ACK] Seq=1 Ack=43201 Win=422 Len=0 TSval=132018660 TSecr=1082454648"
"86","0.496974","192.168.0.86","52.42.164.78","TCP","1506","[TCP segment of a reassembled PDU]"
"87","0.504863","52.42.164.78","192.168.0.86","TCP","66","443  >  63250 [ACK] Seq=1 Ack=44641 Win=422 Len=0 TSval=132018662 TSecr=1082454648"
"88","0.504895","192.168.0.86","52.42.164.78","TCP","1506","[TCP segment of a reassembled PDU]"
"89","0.513074","52.42.164.78","192.168.0.86","TCP","66","443  >  63250 [ACK] Seq=1 Ack=46081 Win=422 Len=0 TSval=132018664 TSecr=1082454656"
"90","0.513118","192.168.0.86","52.42.164.78","TCP","1506","[TCP segment of a reassembled PDU]"
"91","0.522852","52.42.164.78","192.168.0.86","TCP","66","443  >  63250 [ACK] Seq=1 Ack=47521 Win=422 Len=0 TSval=132018667 TSecr=1082454656"
"92","0.522918","192.168.0.86","52.42.164.78","TCP","1506","[TCP segment of a reassembled PDU]"
"93","0.530814","52.42.164.78","192.168.0.86","TCP","66","443  >  63250 [ACK] Seq=1 Ack=48961 Win=422 Len=0 TSval=132018669 TSecr=1082454664"
"94","0.530849","192.168.0.86","52.42.164.78","SSLv2","1506","Encrypted Data"
"95","0.540130","52.42.164.78","192.168.0.86","TCP","66","443  >  63250 [ACK] Seq=1 Ack=50401 Win=422 Len=0 TSval=132018671 TSecr=1082454664"
"96","0.540165","192.168.0.86","52.42.164.78","TCP","1506","[TCP segment of a reassembled PDU]"
"97","0.548118","52.42.164.78","192.168.0.86","TCP","66","443  >  63250 [ACK] Seq=1 Ack=51841 Win=422 Len=0 TSval=132018673 TSecr=1082454673"
"98","0.548193","192.168.0.86","52.42.164.78","TCP","1506","[TCP segment of a reassembled PDU]"
"99","0.565409","52.42.164.78","192.168.0.86","TCP","66","443  >  63250 [ACK] Seq=1 Ack=54721 Win=422 Len=0 TSval=132018677 TSecr=1082454673"
"100","0.565455","192.168.0.86","52.42.164.78","TCP","1506","[TCP segment of a reassembled PDU]"
"101","0.565456","192.168.0.86","52.42.164.78","TCP","1506","[TCP segment of a reassembled PDU]"
"102","0.582248","52.42.164.78","192.168.0.86","TCP","66","443  >  63250 [ACK] Seq=1 Ack=57601 Win=422 Len=0 TSval=132018682 TSecr=1082454681"
"103","0.582310","192.168.0.86","52.42.164.78","TCP","1506","[TCP segment of a reassembled PDU]"
"104","0.582311","192.168.0.86","52.42.164.78","TCP","1506","[TCP segment of a reassembled PDU]"
"105","0.594334","192.168.0.86","52.42.164.78","TCP","1506","[TCP segment of a reassembled PDU]"
"106","0.599737","52.42.164.78","192.168.0.86","TCP","66","443  >  63250 [ACK] Seq=1 Ack=60481 Win=422 Len=0 TSval=132018686 TSecr=1082454689"
"107","0.599770","192.168.0.86","52.42.164.78","TCP","1506","[TCP segment of a reassembled PDU]"
"108","0.616831","52.42.164.78","192.168.0.86","TCP","66","443  >  63250 [ACK] Seq=1 Ack=63361 Win=422 Len=0 TSval=132018690 TSecr=1082454698"
"109","0.616875","192.168.0.86","52.42.164.78","SSLv2","1506","Encrypted Data"
"110","0.616876","192.168.0.86","52.42.164.78","TCP","1506","[TCP segment of a reassembled PDU]"
"111","0.623559","216.58.210.46","192.168.0.86","TLSv1.2","129","Application Data"
"112","0.623604","192.168.0.86","216.58.210.46","TCP","66","62545  >  443 [ACK] Seq=1 Ack=64 Win=4094 Len=0 TSval=1082454947 TSecr=4248004869"
"113","0.623618","216.58.210.46","192.168.0.86","TCP","66","443  >  62545 [FIN, ACK] Seq=64 Ack=1 Win=349 Len=0 TSval=4248004869 TSecr=1082224004"
"114","0.623637","192.168.0.86","216.58.210.46","TCP","66","62545  >  443 [ACK] Seq=1 Ack=65 Win=4096 Len=0 TSval=1082454947 TSecr=4248004869"
"115","0.623686","192.168.0.86","216.58.210.46","TCP","66","62545  >  443 [FIN, ACK] Seq=1 Ack=65 Win=4096 Len=0 TSval=1082454947 TSecr=4248004869"
"116","0.634832","52.42.164.78","192.168.0.86","TCP","66","443  >  63250 [ACK] Seq=1 Ack=66241 Win=422 Len=0 TSval=132018695 TSecr=1082454706"
"117","0.634874","192.168.0.86","52.42.164.78","TCP","1506","[TCP segment of a reassembled PDU]"
"118","0.634875","192.168.0.86","52.42.164.78","TCP","1506","[TCP segment of a reassembled PDU]"
"119","0.635808","216.58.208.142","192.168.0.86","TLSv1.2","129","Application Data"
"120","0.635830","192.168.0.86","216.58.208.142","TCP","66","62546  >  443 [ACK] Seq=1 Ack=64 Win=4094 Len=0 TSval=1082454958 TSecr=4219896866"
"121","0.635836","216.58.208.142","192.168.0.86","TCP","66","443  >  62546 [FIN, ACK] Seq=64 Ack=1 Win=340 Len=0 TSval=4219896866 TSecr=1082224006"
"122","0.635846","192.168.0.86","216.58.208.142","TCP","66","62546  >  443 [ACK] Seq=1 Ack=65 Win=4094 Len=0 TSval=1082454958 TSecr=4219896866"
"123","0.635922","192.168.0.86","216.58.208.142","TCP","66","62546  >  443 [FIN, ACK] Seq=1 Ack=65 Win=4096 Len=0 TSval=1082454959 TSecr=4219896866"
"124","0.642915","216.58.210.46","192.168.0.86","TCP","66","443  >  62545 [ACK] Seq=65 Ack=2 Win=349 Len=0 TSval=4248004889 TSecr=1082454947"
"125","0.651931","52.42.164.78","192.168.0.86","TCP","66","443  >  63250 [ACK] Seq=1 Ack=69121 Win=422 Len=0 TSval=132018699 TSecr=1082454714"
"126","0.651933","52.42.164.78","192.168.0.86","TCP","66","443  >  63250 [ACK] Seq=1 Ack=72001 Win=422 Len=0 TSval=132018699 TSecr=1082454722"
"127","0.651934","52.42.164.78","192.168.0.86","TCP","66","443  >  63250 [ACK] Seq=1 Ack=74881 Win=422 Len=0 TSval=132018699 TSecr=1082454802"
"128","0.651979","192.168.0.86","52.42.164.78","TCP","1506","[TCP segment of a reassembled PDU]"
"129","0.651980","192.168.0.86","52.42.164.78","TCP","1506","[TCP segment of a reassembled PDU]"
"130","0.652020","192.168.0.86","52.42.164.78","TCP","1506","[TCP segment of a reassembled PDU]"
"131","0.652021","192.168.0.86","52.42.164.78","TCP","1506","[TCP segment of a reassembled PDU]"
"132","0.652021","192.168.0.86","52.42.164.78","TCP","1506","[TCP segment of a reassembled PDU]"
"133","0.652022","192.168.0.86","52.42.164.78","TCP","1506","[TCP segment of a reassembled PDU]"
"134","0.658448","52.42.164.78","192.168.0.86","TCP","66","443  >  63250 [ACK] Seq=1 Ack=77761 Win=422 Len=0 TSval=132018701 TSecr=1082454818"
"135","0.658501","192.168.0.86","52.42.164.78","TCP","1506","[TCP segment of a reassembled PDU]"
"136","0.658502","192.168.0.86","52.42.164.78","TCP","1506","[TCP segment of a reassembled PDU]"
"137","0.660575","216.58.208.142","192.168.0.86","TCP","66","443  >  62546 [ACK] Seq=65 Ack=2 Win=340 Len=0 TSval=4219896891 TSecr=1082454959"
"138","0.674948","52.42.164.78","192.168.0.86","TCP","66","443  >  63250 [ACK] Seq=1 Ack=80641 Win=422 Len=0 TSval=132018705 TSecr=1082454834"
"139","0.675207","192.168.0.86","52.42.164.78","TCP","1506","[TCP segment of a reassembled PDU]"
"140","0.675211","192.168.0.86","52.42.164.78","TCP","1506","[TCP segment of a reassembled PDU]"
"141","0.692853","52.42.164.78","192.168.0.86","TCP","66","443  >  63250 [ACK] Seq=1 Ack=83521 Win=422 Len=0 TSval=132018709 TSecr=1082454850"
"142","0.692941","192.168.0.86","52.42.164.78","TCP","1506","[TCP segment of a reassembled PDU]"
"143","0.692942","192.168.0.86","52.42.164.78","SSLv2","1506","Encrypted Data"
"144","0.701701","52.42.164.78","192.168.0.86","TCP","66","443  >  63250 [ACK] Seq=1 Ack=84961 Win=434 Len=0 TSval=132018711 TSecr=1082454866"
"145","0.701731","192.168.0.86","52.42.164.78","TCP","1506","[TCP segment of a reassembled PDU]"
"146","0.710107","52.42.164.78","192.168.0.86","TCP","66","443  >  63250 [ACK] Seq=1 Ack=86401 Win=445 Len=0 TSval=132018713 TSecr=1082454874"
"147","0.710177","192.168.0.86","52.42.164.78","TCP","1506","[TCP segment of a reassembled PDU]"
"148","0.726507","52.42.164.78","192.168.0.86","TCP","66","443  >  63250 [ACK] Seq=1 Ack=87841 Win=456 Len=0 TSval=132018718 TSecr=1082454891"
"149","0.726560","192.168.0.86","52.42.164.78","TCP","1506","[TCP segment of a reassembled PDU]"
"150","0.732708","52.42.164.78","192.168.0.86","TCP","66","443  >  63250 [ACK] Seq=1 Ack=89281 Win=467 Len=0 TSval=132018719 TSecr=1082454891"
"151","0.732759","192.168.0.86","52.42.164.78","TCP","1506","[TCP segment of a reassembled PDU]"
"152","0.744543","52.42.164.78","192.168.0.86","TCP","66","443  >  63250 [ACK] Seq=1 Ack=90721 Win=479 Len=0 TSval=132018722 TSecr=1082454907"
"153","0.744559","192.168.0.86","52.42.164.78","TCP","1506","[TCP segment of a reassembled PDU]"
"154","0.751065","52.42.164.78","192.168.0.86","TCP","66","443  >  63250 [ACK] Seq=1 Ack=92161 Win=490 Len=0 TSval=132018724 TSecr=1082454907"
"155","0.751084","192.168.0.86","52.42.164.78","TCP","1506","[TCP segment of a reassembled PDU]"
"156","0.756979","52.42.164.78","192.168.0.86","TCP","66","443  >  63250 [ACK] Seq=1 Ack=93601 Win=501 Len=0 TSval=132018725 TSecr=1082454919"
"157","0.757032","192.168.0.86","52.42.164.78","TCP","1506","[TCP segment of a reassembled PDU]"
"158","0.757033","192.168.0.86","52.42.164.78","TCP","1506","[TCP segment of a reassembled PDU]"
"159","0.763612","52.42.164.78","192.168.0.86","TCP","66","443  >  63250 [ACK] Seq=1 Ack=95041 Win=512 Len=0 TSval=132018727 TSecr=1082454924"
"160","0.763633","192.168.0.86","52.42.164.78","TCP","1506","[TCP segment of a reassembled PDU]"
"161","0.763633","192.168.0.86","52.42.164.78","TCP","1506","[TCP segment of a reassembled PDU]"
"162","0.779057","52.42.164.78","192.168.0.86","TCP","66","443  >  63250 [ACK] Seq=1 Ack=96481 Win=524 Len=0 TSval=132018731 TSecr=1082454941"
"163","0.779083","192.168.0.86","52.42.164.78","TCP","1506","[TCP segment of a reassembled PDU]"
"164","0.779083","192.168.0.86","52.42.164.78","TCP","1506","[TCP segment of a reassembled PDU]"
"165","0.784629","52.42.164.78","192.168.0.86","TCP","66","443  >  63250 [ACK] Seq=1 Ack=97921 Win=535 Len=0 TSval=132018732 TSecr=1082454941"
"166","0.784672","192.168.0.86","52.42.164.78","TCP","1506","[TCP segment of a reassembled PDU]"
"167","0.784673","192.168.0.86","52.42.164.78","TCP","1506","[TCP segment of a reassembled PDU]"
"168","0.796823","52.42.164.78","192.168.0.86","TCP","66","443  >  63250 [ACK] Seq=1 Ack=99361 Win=546 Len=0 TSval=132018735 TSecr=1082454958"
"169","0.796846","192.168.0.86","52.42.164.78","TCP","1506","[TCP segment of a reassembled PDU]"
"170","0.796846","192.168.0.86","52.42.164.78","TCP","1506","[TCP segment of a reassembled PDU]"
"171","0.802803","52.42.164.78","192.168.0.86","TCP","66","443  >  63250 [ACK] Seq=1 Ack=100801 Win=557 Len=0 TSval=132018737 TSecr=1082454958"
"172","0.802919","192.168.0.86","52.42.164.78","TCP","1506","[TCP segment of a reassembled PDU]"
"173","0.802921","192.168.0.86","52.42.164.78","TCP","1506","[TCP segment of a reassembled PDU]"
"174","0.813776","52.42.164.78","192.168.0.86","TCP","66","443  >  63250 [ACK] Seq=1 Ack=102241 Win=569 Len=0 TSval=132018739 TSecr=1082454974"
"175","0.813809","192.168.0.86","52.42.164.78","TCP","1506","[TCP segment of a reassembled PDU]"
"176","0.813809","192.168.0.86","52.42.164.78","TCP","1506","[TCP segment of a reassembled PDU]"
"177","0.819386","52.42.164.78","192.168.0.86","TCP","66","443  >  63250 [ACK] Seq=1 Ack=103681 Win=580 Len=0 TSval=132018741 TSecr=1082454974"
"178","0.819423","192.168.0.86","52.42.164.78","SSLv2","1506","Encrypted Data"
"179","0.819424","192.168.0.86","52.42.164.78","TCP","1506","[TCP segment of a reassembled PDU]"
"180","0.827082","52.42.164.78","192.168.0.86","TCP","66","443  >  63250 [ACK] Seq=1 Ack=105121 Win=591 Len=0 TSval=132018743 TSecr=1082454974"
"181","0.827168","192.168.0.86","52.42.164.78","TCP","1506","[TCP segment of a reassembled PDU]"
"182","0.827169","192.168.0.86","52.42.164.78","TCP","1506","[TCP segment of a reassembled PDU]"
"183","0.832759","52.42.164.78","192.168.0.86","TCP","66","443  >  63250 [ACK] Seq=1 Ack=106561 Win=602 Len=0 TSval=132018744 TSecr=1082454974"
"184","0.832781","192.168.0.86","52.42.164.78","TCP","1506","[TCP segment of a reassembled PDU]"
"185","0.832781","192.168.0.86","52.42.164.78","TCP","1506","[TCP segment of a reassembled PDU]"
"186","0.838445","52.42.164.78","192.168.0.86","TCP","66","443  >  63250 [ACK] Seq=1 Ack=108001 Win=614 Len=0 TSval=132018745 TSecr=1082454974"
"187","0.838498","192.168.0.86","52.42.164.78","TCP","1506","[TCP segment of a reassembled PDU]"
"188","0.838498","192.168.0.86","52.42.164.78","TCP","1506","[TCP segment of a reassembled PDU]"
"189","0.845269","52.42.164.78","192.168.0.86","TCP","66","443  >  63250 [ACK] Seq=1 Ack=109441 Win=625 Len=0 TSval=132018747 TSecr=1082454974"
"190","0.845292","192.168.0.86","52.42.164.78","SSLv2","1506","Encrypted Data"
"191","0.845292","192.168.0.86","52.42.164.78","TCP","1506","[TCP segment of a reassembled PDU]"
"192","0.850609","52.42.164.78","192.168.0.86","TCP","66","443  >  63250 [ACK] Seq=1 Ack=110881 Win=636 Len=0 TSval=132018749 TSecr=1082454980"
"193","0.850644","192.168.0.86","52.42.164.78","TCP","1506","[TCP segment of a reassembled PDU]"
"194","0.850644","192.168.0.86","52.42.164.78","TCP","1506","[TCP segment of a reassembled PDU]"
"195","0.856998","52.42.164.78","192.168.0.86","TCP","66","443  >  63250 [ACK] Seq=1 Ack=112321 Win=647 Len=0 TSval=132018750 TSecr=1082454980"
"196","0.857036","192.168.0.86","52.42.164.78","TCP","1506","[TCP segment of a reassembled PDU]"
"197","0.857036","192.168.0.86","52.42.164.78","TCP","1506","[TCP segment of a reassembled PDU]"
"198","0.863728","52.42.164.78","192.168.0.86","TCP","66","443  >  63250 [ACK] Seq=1 Ack=113761 Win=659 Len=0 TSval=132018752 TSecr=1082454996"
"199","0.863750","192.168.0.86","52.42.164.78","TCP","1506","[TCP segment of a reassembled PDU]"
"200","0.863750","192.168.0.86","52.42.164.78","TCP","1506","[TCP segment of a reassembled PDU]"
"201","0.869924","52.42.164.78","192.168.0.86","TCP","66","443  >  63250 [ACK] Seq=1 Ack=115201 Win=670 Len=0 TSval=132018753 TSecr=1082454996"
"202","0.869980","192.168.0.86","52.42.164.78","TCP","1506","[TCP segment of a reassembled PDU]"
"203","0.869980","192.168.0.86","52.42.164.78","TCP","1506","[TCP segment of a reassembled PDU]"
"204","0.875627","52.42.164.78","192.168.0.86","TCP","66","443  >  63250 [ACK] Seq=1 Ack=116641 Win=681 Len=0 TSval=132018755 TSecr=1082455013"
"205","0.875726","192.168.0.86","52.42.164.78","TCP","1506","[TCP segment of a reassembled PDU]"
"206","0.875727","192.168.0.86","52.42.164.78","TCP","1506","[TCP segment of a reassembled PDU]"
"207","0.882660","52.42.164.78","192.168.0.86","TCP","66","443  >  63250 [ACK] Seq=1 Ack=118081 Win=692 Len=0 TSval=132018757 TSecr=1082455013"
"208","0.882748","192.168.0.86","52.42.164.78","TCP","1506","[TCP segment of a reassembled PDU]"
"209","0.882751","192.168.0.86","52.42.164.78","TCP","1506","[TCP segment of a reassembled PDU]"
"210","0.888060","52.42.164.78","192.168.0.86","TCP","66","443  >  63250 [ACK] Seq=1 Ack=119521 Win=704 Len=0 TSval=132018758 TSecr=1082455021"
"211","0.888144","192.168.0.86","52.42.164.78","TCP","1506","[TCP segment of a reassembled PDU]"
"212","0.888144","192.168.0.86","52.42.164.78","TCP","1506","[TCP segment of a reassembled PDU]"
"213","0.895125","52.42.164.78","192.168.0.86","TCP","66","443  >  63250 [ACK] Seq=1 Ack=120961 Win=715 Len=0 TSval=132018760 TSecr=1082455029"
"214","0.895249","192.168.0.86","52.42.164.78","TCP","1506","[TCP segment of a reassembled PDU]"
"215","0.895251","192.168.0.86","52.42.164.78","TCP","1506","[TCP segment of a reassembled PDU]"
"216","0.901039","52.42.164.78","192.168.0.86","TCP","66","443  >  63250 [ACK] Seq=1 Ack=122401 Win=726 Len=0 TSval=132018761 TSecr=1082455044"
"217","0.901158","192.168.0.86","52.42.164.78","SSLv2","1506","Encrypted Data"
"218","0.901158","192.168.0.86","52.42.164.78","TCP","1506","[TCP segment of a reassembled PDU]"
"219","0.907101","52.42.164.78","192.168.0.86","TCP","66","443  >  63250 [ACK] Seq=1 Ack=123841 Win=737 Len=0 TSval=132018763 TSecr=1082455050"
"220","0.907137","192.168.0.86","52.42.164.78","TCP","1506","[TCP segment of a reassembled PDU]"
"221","0.907137","192.168.0.86","52.42.164.78","TCP","1506","[TCP segment of a reassembled PDU]"
"222","0.912180","52.42.164.78","192.168.0.86","TCP","66","443  >  63250 [ACK] Seq=1 Ack=125281 Win=749 Len=0 TSval=132018764 TSecr=1082455061"
"223","0.912265","192.168.0.86","52.42.164.78","TCP","1506","[TCP segment of a reassembled PDU]"
"224","0.912267","192.168.0.86","52.42.164.78","TCP","1506","[TCP segment of a reassembled PDU]"
"225","0.919866","52.42.164.78","192.168.0.86","TCP","66","443  >  63250 [ACK] Seq=1 Ack=126721 Win=760 Len=0 TSval=132018766 TSecr=1082455067"
"226","0.919975","192.168.0.86","52.42.164.78","TCP","1506","[TCP segment of a reassembled PDU]"
"227","0.919977","192.168.0.86","52.42.164.78","TCP","1506","[TCP segment of a reassembled PDU]"
"228","0.926100","52.42.164.78","192.168.0.86","TCP","66","443  >  63250 [ACK] Seq=1 Ack=128161 Win=771 Len=0 TSval=132018767 TSecr=1082455072"
"229","0.926150","192.168.0.86","52.42.164.78","TCP","1506","[TCP segment of a reassembled PDU]"
"230","0.926154","192.168.0.86","52.42.164.78","TCP","1506","[TCP segment of a reassembled PDU]"
"231","0.931976","52.42.164.78","192.168.0.86","TCP","66","443  >  63250 [ACK] Seq=1 Ack=129601 Win=782 Len=0 TSval=132018769 TSecr=1082455072"
"232","0.932047","192.168.0.86","52.42.164.78","TCP","1506","[TCP segment of a reassembled PDU]"
"233","0.932048","192.168.0.86","52.42.164.78","TCP","1506","[TCP segment of a reassembled PDU]"
"234","0.938115","52.42.164.78","192.168.0.86","TCP","66","443  >  63250 [ACK] Seq=1 Ack=131041 Win=794 Len=0 TSval=132018770 TSecr=1082455078"
"235","0.938159","192.168.0.86","52.42.164.78","TCP","1506","[TCP segment of a reassembled PDU]"
"236","0.943857","52.42.164.78","192.168.0.86","TCP","66","443  >  63250 [ACK] Seq=1 Ack=132481 Win=805 Len=0 TSval=132018772 TSecr=1082455078"
"237","0.943896","192.168.0.86","52.42.164.78","TCP","1506","[TCP segment of a reassembled PDU]"
"238","0.951106","52.42.164.78","192.168.0.86","TCP","66","443  >  63250 [ACK] Seq=1 Ack=133921 Win=816 Len=0 TSval=132018774 TSecr=1082455093"
"239","0.951151","192.168.0.86","52.42.164.78","TCP","1506","[TCP segment of a reassembled PDU]"
"240","0.957005","52.42.164.78","192.168.0.86","TCP","66","443  >  63250 [ACK] Seq=1 Ack=135361 Win=827 Len=0 TSval=132018775 TSecr=1082455093"
"241","0.957087","192.168.0.86","52.42.164.78","TCP","1506","[TCP segment of a reassembled PDU]"
"242","0.962928","52.42.164.78","192.168.0.86","TCP","66","443  >  63250 [ACK] Seq=1 Ack=136801 Win=839 Len=0 TSval=132018777 TSecr=1082455098"
"243","0.963017","192.168.0.86","52.42.164.78","SSLv2","1506","Encrypted Data"
"244","0.969090","52.42.164.78","192.168.0.86","TCP","66","443  >  63250 [ACK] Seq=1 Ack=138241 Win=850 Len=0 TSval=132018778 TSecr=1082455098"
"245","0.969160","192.168.0.86","52.42.164.78","TCP","1506","[TCP segment of a reassembled PDU]"
"246","0.974563","52.42.164.78","192.168.0.86","TCP","66","443  >  63250 [ACK] Seq=1 Ack=139681 Win=861 Len=0 TSval=132018780 TSecr=1082455110"
"247","0.974583","192.168.0.86","52.42.164.78","TCP","1506","[TCP segment of a reassembled PDU]"
"248","0.981584","52.42.164.78","192.168.0.86","TCP","66","443  >  63250 [ACK] Seq=1 Ack=141121 Win=872 Len=0 TSval=132018781 TSecr=1082455110"
"249","0.981601","192.168.0.86","52.42.164.78","TCP","1506","[TCP segment of a reassembled PDU]"
"250","0.987525","52.42.164.78","192.168.0.86","TCP","66","443  >  63250 [ACK] Seq=1 Ack=142561 Win=884 Len=0 TSval=132018783 TSecr=1082455116"
"251","0.987592","192.168.0.86","52.42.164.78","TCP","1506","[TCP segment of a reassembled PDU]"
"252","0.994101","52.42.164.78","192.168.0.86","TCP","66","443  >  63250 [ACK] Seq=1 Ack=144001 Win=895 Len=0 TSval=132018784 TSecr=1082455116"
"253","0.994185","192.168.0.86","52.42.164.78","TCP","1506","63250  >  443 [ACK] Seq=214561 Ack=1 Win=4096 Len=1440 TSval=1082455291 TSecr=132018784"
"254","1.000270","52.42.164.78","192.168.0.86","TCP","66","443  >  63250 [ACK] Seq=1 Ack=145441 Win=906 Len=0 TSval=132018786 TSecr=1082455126"
"255","1.000294","192.168.0.86","52.42.164.78","TCP","1506","[TCP segment of a reassembled PDU]"
"256","1.006841","52.42.164.78","192.168.0.86","TCP","66","443  >  63250 [ACK] Seq=1 Ack=146881 Win=917 Len=0 TSval=132018788 TSecr=1082455126"
"257","1.006868","192.168.0.86","52.42.164.78","SSLv2","1506","Encrypted Data"
"258","1.013914","52.42.164.78","192.168.0.86","TCP","66","443  >  63250 [ACK] Seq=1 Ack=148321 Win=929 Len=0 TSval=132018789 TSecr=1082455131"
"259","1.013947","192.168.0.86","52.42.164.78","TCP","1506","[TCP segment of a reassembled PDU]"
"260","1.019848","52.42.164.78","192.168.0.86","TCP","66","443  >  63250 [ACK] Seq=1 Ack=149761 Win=940 Len=0 TSval=132018791 TSecr=1082455131"
"261","1.019877","192.168.0.86","52.42.164.78","TCP","1506","[TCP segment of a reassembled PDU]"
"262","1.025746","52.42.164.78","192.168.0.86","TCP","66","443  >  63250 [ACK] Seq=1 Ack=151201 Win=951 Len=0 TSval=132018792 TSecr=1082455138"
"263","1.025820","192.168.0.86","52.42.164.78","TCP","1506","[TCP segment of a reassembled PDU]"
"264","1.031649","52.42.164.78","192.168.0.86","TCP","66","443  >  63250 [ACK] Seq=1 Ack=152641 Win=962 Len=0 TSval=132018794 TSecr=1082455138"
"265","1.031681","192.168.0.86","52.42.164.78","TCP","1506","[TCP segment of a reassembled PDU]"
"266","1.037820","52.42.164.78","192.168.0.86","TCP","66","443  >  63250 [ACK] Seq=1 Ack=154081 Win=974 Len=0 TSval=132018795 TSecr=1082455143"
"267","1.037855","192.168.0.86","52.42.164.78","TCP","1506","[TCP segment of a reassembled PDU]"
"268","1.043757","52.42.164.78","192.168.0.86","TCP","66","443  >  63250 [ACK] Seq=1 Ack=155521 Win=985 Len=0 TSval=132018797 TSecr=1082455143"
"269","1.043813","192.168.0.86","52.42.164.78","SSLv2","1506","Encrypted Data"
"270","1.050779","52.42.164.78","192.168.0.86","TCP","66","443  >  63250 [ACK] Seq=1 Ack=156961 Win=996 Len=0 TSval=132018799 TSecr=1082455148"
"271","1.050808","192.168.0.86","52.42.164.78","TCP","1506","[TCP segment of a reassembled PDU]"
"272","1.056943","52.42.164.78","192.168.0.86","TCP","66","443  >  63250 [ACK] Seq=1 Ack=158401 Win=1007 Len=0 TSval=132018800 TSecr=1082455148"
"273","1.056968","192.168.0.86","52.42.164.78","TCP","1506","[TCP segment of a reassembled PDU]"
"274","1.062155","52.42.164.78","192.168.0.86","TCP","66","443  >  63250 [ACK] Seq=1 Ack=159841 Win=1019 Len=0 TSval=132018801 TSecr=1082455154"
"275","1.062242","192.168.0.86","52.42.164.78","TCP","1506","[TCP segment of a reassembled PDU]"
"276","1.068549","52.42.164.78","192.168.0.86","TCP","66","443  >  63250 [ACK] Seq=1 Ack=161281 Win=1030 Len=0 TSval=132018803 TSecr=1082455154"
"277","1.068587","192.168.0.86","52.42.164.78","TCP","1506","[TCP segment of a reassembled PDU]"
"278","1.074717","52.42.164.78","192.168.0.86","TCP","66","443  >  63250 [ACK] Seq=1 Ack=162721 Win=1041 Len=0 TSval=132018805 TSecr=1082455159"
"279","1.074776","192.168.0.86","52.42.164.78","TCP","1506","[TCP segment of a reassembled PDU]"
"280","1.081735","52.42.164.78","192.168.0.86","TCP","66","443  >  63250 [ACK] Seq=1 Ack=164161 Win=1052 Len=0 TSval=132018806 TSecr=1082455159"
"281","1.081811","192.168.0.86","52.42.164.78","SSLv2","1506","Encrypted Data"
"282","1.086983","52.42.164.78","192.168.0.86","TCP","66","443  >  63250 [ACK] Seq=1 Ack=165601 Win=1064 Len=0 TSval=132018808 TSecr=1082455165"
"283","1.087022","192.168.0.86","52.42.164.78","TCP","1506","[TCP segment of a reassembled PDU]"
"284","1.094487","52.42.164.78","192.168.0.86","TCP","66","443  >  63250 [ACK] Seq=1 Ack=167041 Win=1075 Len=0 TSval=132018810 TSecr=1082455165"
"285","1.094658","192.168.0.86","52.42.164.78","TCP","1506","63250  >  443 [ACK] Seq=237601 Ack=1 Win=4096 Len=1440 TSval=1082455384 TSecr=132018810"
"286","1.100195","52.42.164.78","192.168.0.86","TCP","66","443  >  63250 [ACK] Seq=1 Ack=168481 Win=1086 Len=0 TSval=132018811 TSecr=1082455171"
"287","1.100275","192.168.0.86","52.42.164.78","TCP","1506","[TCP segment of a reassembled PDU]"
"288","1.106794","52.42.164.78","192.168.0.86","TCP","66","443  >  63250 [ACK] Seq=1 Ack=169921 Win=1097 Len=0 TSval=132018813 TSecr=1082455171"
"289","1.106860","192.168.0.86","52.42.164.78","SSLv2","1506","Encrypted Data"
"290","1.112899","52.42.164.78","192.168.0.86","TCP","66","443  >  63250 [ACK] Seq=1 Ack=171361 Win=1109 Len=0 TSval=132018814 TSecr=1082455177"
"291","1.112957","192.168.0.86","52.42.164.78","TCP","1506","63250  >  443 [ACK] Seq=241921 Ack=1 Win=4096 Len=1440 TSval=1082455401 TSecr=132018814"
"292","1.118819","52.42.164.78","192.168.0.86","TCP","66","443  >  63250 [ACK] Seq=1 Ack=172801 Win=1120 Len=0 TSval=132018816 TSecr=1082455177"
"293","1.118877","192.168.0.86","52.42.164.78","TCP","1506","[TCP segment of a reassembled PDU]"
"294","1.124735","52.42.164.78","192.168.0.86","TCP","66","443  >  63250 [ACK] Seq=1 Ack=174241 Win=1131 Len=0 TSval=132018817 TSecr=1082455182"
"295","1.124775","192.168.0.86","52.42.164.78","TCP","1506","[TCP segment of a reassembled PDU]"
"296","1.131783","52.42.164.78","192.168.0.86","TCP","66","443  >  63250 [ACK] Seq=1 Ack=175681 Win=1142 Len=0 TSval=132018819 TSecr=1082455182"
"297","1.131809","192.168.0.86","52.42.164.78","TCP","1506","[TCP segment of a reassembled PDU]"
"298","1.137507","52.42.164.78","192.168.0.86","TCP","66","443  >  63250 [ACK] Seq=1 Ack=177121 Win=1154 Len=0 TSval=132018820 TSecr=1082455189"
"299","1.137575","192.168.0.86","52.42.164.78","TCP","1506","[TCP segment of a reassembled PDU]"
"300","1.143880","52.42.164.78","192.168.0.86","TCP","66","443  >  63250 [ACK] Seq=1 Ack=178561 Win=1165 Len=0 TSval=132018822 TSecr=1082455189"
"301","1.143902","192.168.0.86","52.42.164.78","TCP","1506","[TCP segment of a reassembled PDU]"
"302","1.149773","52.42.164.78","192.168.0.86","TCP","66","443  >  63250 [ACK] Seq=1 Ack=180001 Win=1176 Len=0 TSval=132018823 TSecr=1082455194"
"303","1.149820","192.168.0.86","52.42.164.78","TCP","1506","[TCP segment of a reassembled PDU]"
"304","1.155250","52.42.164.78","192.168.0.86","TCP","66","443  >  63250 [ACK] Seq=1 Ack=181441 Win=1187 Len=0 TSval=132018825 TSecr=1082455194"
"305","1.155326","192.168.0.86","52.42.164.78","TCP","1506","[TCP segment of a reassembled PDU]"
"306","1.162771","52.42.164.78","192.168.0.86","TCP","66","443  >  63250 [ACK] Seq=1 Ack=182881 Win=1199 Len=0 TSval=132018827 TSecr=1082455201"
"307","1.162822","192.168.0.86","52.42.164.78","TCP","1506","[TCP segment of a reassembled PDU]"
"308","1.168683","52.42.164.78","192.168.0.86","TCP","66","443  >  63250 [ACK] Seq=1 Ack=184321 Win=1210 Len=0 TSval=132018828 TSecr=1082455201"
"309","1.168738","192.168.0.86","52.42.164.78","TCP","1506","[TCP segment of a reassembled PDU]"
"310","1.174820","52.42.164.78","192.168.0.86","TCP","66","443  >  63250 [ACK] Seq=1 Ack=185761 Win=1221 Len=0 TSval=132018830 TSecr=1082455206"
"311","1.174912","192.168.0.86","52.42.164.78","TCP","1506","[TCP segment of a reassembled PDU]"
"312","1.180751","52.42.164.78","192.168.0.86","TCP","66","443  >  63250 [ACK] Seq=1 Ack=187201 Win=1232 Len=0 TSval=132018831 TSecr=1082455206"
"313","1.180813","192.168.0.86","52.42.164.78","TCP","1506","[TCP segment of a reassembled PDU]"
"314","1.186446","52.42.164.78","192.168.0.86","TCP","66","443  >  63250 [ACK] Seq=1 Ack=188641 Win=1244 Len=0 TSval=132018833 TSecr=1082455211"
"315","1.186480","192.168.0.86","52.42.164.78","TCP","1506","[TCP segment of a reassembled PDU]"
"316","1.193266","52.42.164.78","192.168.0.86","TCP","66","443  >  63250 [ACK] Seq=1 Ack=190081 Win=1255 Len=0 TSval=132018834 TSecr=1082455211"
"317","1.193330","192.168.0.86","52.42.164.78","TCP","1506","[TCP segment of a reassembled PDU]"
"318","1.200059","52.42.164.78","192.168.0.86","TCP","66","443  >  63250 [ACK] Seq=1 Ack=191521 Win=1266 Len=0 TSval=132018836 TSecr=1082455216"
"319","1.200154","192.168.0.86","52.42.164.78","TCP","1506","[TCP segment of a reassembled PDU]"
"320","1.205759","52.42.164.78","192.168.0.86","TCP","66","443  >  63250 [ACK] Seq=1 Ack=192961 Win=1277 Len=0 TSval=132018837 TSecr=1082455216"
"321","1.205802","192.168.0.86","52.42.164.78","TCP","1506","[TCP segment of a reassembled PDU]"
"322","1.211874","52.42.164.78","192.168.0.86","TCP","66","443  >  63250 [ACK] Seq=1 Ack=194401 Win=1289 Len=0 TSval=132018839 TSecr=1082455223"
"323","1.211940","192.168.0.86","52.42.164.78","TCP","1506","[TCP segment of a reassembled PDU]"
"324","1.217832","52.42.164.78","192.168.0.86","TCP","66","443  >  63250 [ACK] Seq=1 Ack=195841 Win=1300 Len=0 TSval=132018840 TSecr=1082455223"
"325","1.217897","192.168.0.86","52.42.164.78","TCP","1506","[TCP segment of a reassembled PDU]"
"326","1.224661","52.42.164.78","192.168.0.86","TCP","66","443  >  63250 [ACK] Seq=1 Ack=197281 Win=1311 Len=0 TSval=132018842 TSecr=1082455229"
"327","1.224721","192.168.0.86","52.42.164.78","TCP","1506","[TCP segment of a reassembled PDU]"
"328","1.224722","192.168.0.86","52.42.164.78","TCP","1506","[TCP segment of a reassembled PDU]"
"329","1.230793","52.42.164.78","192.168.0.86","TCP","66","443  >  63250 [ACK] Seq=1 Ack=198721 Win=1322 Len=0 TSval=132018844 TSecr=1082455229"
"330","1.230861","192.168.0.86","52.42.164.78","TCP","1506","[TCP segment of a reassembled PDU]"
"331","1.230862","192.168.0.86","52.42.164.78","TCP","1506","[TCP segment of a reassembled PDU]"
"332","1.236929","52.42.164.78","192.168.0.86","TCP","66","443  >  63250 [ACK] Seq=1 Ack=200161 Win=1334 Len=0 TSval=132018845 TSecr=1082455234"
"333","1.236956","192.168.0.86","52.42.164.78","TCP","1506","[TCP segment of a reassembled PDU]"
"334","1.236956","192.168.0.86","52.42.164.78","TCP","1506","[TCP segment of a reassembled PDU]"
"335","1.242166","52.42.164.78","192.168.0.86","TCP","66","443  >  63250 [ACK] Seq=1 Ack=201601 Win=1345 Len=0 TSval=132018846 TSecr=1082455234"
"336","1.242194","192.168.0.86","52.42.164.78","TCP","1506","[TCP segment of a reassembled PDU]"
"337","1.242195","192.168.0.86","52.42.164.78","SSLv2","1506","Encrypted Data"
"338","1.248786","52.42.164.78","192.168.0.86","TCP","66","443  >  63250 [ACK] Seq=1 Ack=203041 Win=1356 Len=0 TSval=132018848 TSecr=1082455240"
"339","1.248860","192.168.0.86","52.42.164.78","TCP","1506","[TCP segment of a reassembled PDU]"
"340","1.248861","192.168.0.86","52.42.164.78","TCP","1506","[TCP segment of a reassembled PDU]"
"341","1.255592","52.42.164.78","192.168.0.86","TCP","66","443  >  63250 [ACK] Seq=1 Ack=204481 Win=1367 Len=0 TSval=132018850 TSecr=1082455245"
"342","1.255621","192.168.0.86","52.42.164.78","TCP","1506","[TCP segment of a reassembled PDU]"
"343","1.255622","192.168.0.86","52.42.164.78","TCP","1506","[TCP segment of a reassembled PDU]"
